{
  "version": "1.0",
  "goal_rules": {
    "goal_classes": ["person", "red-marker"],
    "priority": "confidence_times_area",
    "min_confidence": 0.5,
    "min_area_ratio": 0
  },
  "obstacle_rules": {
    "obstacle_classes": ["car", "truck", "tree"]
  },
  "sectors": {
    "mode": "thirds",
    "approach_zone_height_ratio": 0.55
  },
  "blending": {
    "goal_weight": 0.65,
    "obstacle_bias_deg": {
      "left": -25,
      "center": 0,
      "right": 25
    },
    "heading_clamp_deg": [-40, 40],
    "speed_scale_when_goal_visible": 0.85,
    "speed_scale_reduction_by_center_score": [
      { "threshold": 0.2, "speed_scale": 0.45 },
      { "threshold": 0.12, "speed_scale": 0.7 }
    ]
  },
  "output": {
    "heading_bounds_deg": [-40, 40],
    "speed_scale_bounds": [0.2, 1.0]
  }
}
